{
  "$schema": "https://json-schema.org/draft/2020-12/schema",
  "title": "MyUnityMCP Codex Evidence",
  "type": "object",
  "required": ["evidence_id", "node_id", "kind", "source_revision", "created_at", "artifacts", "verdict"],
  "properties": {
    "evidence_id": {"type": "string", "minLength": 1},
    "node_id": {"type": "string", "minLength": 1},
    "kind": {"type": "string", "minLength": 1},
    "source_revision": {"type": "string", "minLength": 1},
    "created_at": {"type": "string", "minLength": 1},
    "environment": {"type": "object"},
    "commands": {"type": "array", "items": {"type": "object"}},
    "artifacts": {"type": "array", "items": {"type": "string"}},
    "findings": {"type": "array"},
    "verdict": {"enum": ["pass", "fail", "blocked", "human_required"]},
    "notes": {"type": "string"}
  },
  "additionalProperties": true
}
