{
  "evidence_id": "phase0-current-release-resolution",
  "node_id": "phase_00_release_integrity",
  "kind": "current_release_resolution",
  "source_revision": "a3edfbffcaa15a45ff29c8f8f49a3771b131e8a4",
  "created_at": "2026-08-07T01:32:00+09:00",
  "environment": {
    "repository": "DarumaPPAP/MyUnityMCP",
    "branch": "feature/graph-engineering-master"
  },
  "commands": [],
  "artifacts": [
    "Development/GraphEngineering/docs/release/release-integrity-policy.md",
    ".github/workflows/release-tag.yml",
    "Tests/Compatibility/release-verification.yaml"
  ],
  "findings": [
    {"tag": "v1.0.0", "commit": "baa9a1a5e0324560cea099a1dbddeea45e7a8527"},
    {"branch": "main", "commit": "1ffec90b150b76a0cb40cac98aa25ae7fa31ba76"},
    {"relation": "main_ahead_by_1"},
    {"changed_path": ".github/workflows/release-tag.yml"},
    {"resolution": "keep_tag_immutable_and_rerun_from_tag_commit"}
  ],
  "verdict": "pass",
  "notes": "No tag was moved. Future product changes require a new version."
}
