{
  "evidence_id": "phase0-release-integrity-tests",
  "node_id": "phase_00_release_integrity",
  "kind": "release_integrity_tests",
  "source_revision": "a3edfbffcaa15a45ff29c8f8f49a3771b131e8a4",
  "created_at": "2026-08-07T01:32:00+09:00",
  "environment": {
    "repository": "DarumaPPAP/MyUnityMCP",
    "branch": "feature/graph-engineering-master"
  },
  "commands": [],
  "artifacts": [
    "Development/GraphEngineering/scripts/release_integrity_guard.py",
    "Development/GraphEngineering/tests/test_release_integrity_guard.py",
    ".github/workflows/release-tag.yml"
  ],
  "findings": [
    {"suite": "release_integrity_guard", "tests": 7, "result": "pass"},
    {"check": "published_tag_force_move", "result": "rejected"},
    {"check": "existing_tag_rerun_source", "result": "tag_commit"}
  ],
  "verdict": "pass",
  "notes": "Seven focused unit tests passed locally; the existing repository release contract remains the product gate."
}
