{
  "evidence_id": "bootstrap-state-validation",
  "node_id": "bootstrap_development_harness",
  "kind": "state_validation",
  "source_revision": "a3edfbffcaa15a45ff29c8f8f49a3771b131e8a4",
  "created_at": "2026-08-07T01:32:00+09:00",
  "environment": {
    "repository": "DarumaPPAP/MyUnityMCP",
    "branch": "feature/graph-engineering-master"
  },
  "commands": [],
  "artifacts": [
    "Development/GraphEngineering/graph/implementation-graph.json",
    "Development/GraphEngineering/state/roadmap-state.json",
    "Development/GraphEngineering/schemas/roadmap-state.schema.json"
  ],
  "findings": [
    {"check": "graph_is_dag", "result": "pass"},
    {"check": "all_graph_nodes_have_state", "result": "pass"},
    {"check": "terminal_goal_initially_false", "result": "pass"}
  ],
  "verdict": "pass",
  "notes": "Graph and State structure are complete and machine-readable."
}
