{
  "evidence_id": "phase0-release-policy",
  "node_id": "phase_00_release_integrity",
  "kind": "release_policy",
  "source_revision": "a3edfbffcaa15a45ff29c8f8f49a3771b131e8a4",
  "created_at": "2026-08-07T01:32:00+09:00",
  "environment": {
    "repository": "DarumaPPAP/MyUnityMCP",
    "branch": "feature/graph-engineering-master"
  },
  "commands": [],
  "artifacts": [
    "Development/GraphEngineering/docs/release/release-integrity-policy.md",
    "AGENTS.md",
    "Tests/Compatibility/release-verification.yaml"
  ],
  "findings": [
    {"policy": "published_tag_immutable", "result": "enforced"},
    {"policy": "future_product_change_requires_new_version", "result": "enforced"},
    {"policy": "human_release_gate", "result": "enforced"}
  ],
  "verdict": "pass",
  "notes": "Release policy now matches the observed published state."
}
