{
  "evidence_id": "bootstrap-harness-validation",
  "node_id": "bootstrap_development_harness",
  "kind": "harness_validation",
  "source_revision": "a3edfbffcaa15a45ff29c8f8f49a3771b131e8a4",
  "created_at": "2026-08-07T01:32:00+09:00",
  "environment": {
    "repository": "DarumaPPAP/MyUnityMCP",
    "branch": "feature/graph-engineering-master"
  },
  "commands": [],
  "artifacts": [
    "Development/GraphEngineering/VALIDATION_REPORT.json",
    "Development/GraphEngineering/scripts/roadmap_harness.py",
    "Development/GraphEngineering/tests/test_roadmap_harness.py",
    "Development/GraphEngineering/tests/test_graph_viewer.py",
    "Development/GraphEngineering/tests/test_delivery_guard.py"
  ],
  "findings": [
    {"check": "python_unit_tests", "result": "pass", "tests": 17},
    {"check": "graph_state_validation", "result": "pass"},
    {"check": "viewer_projection", "result": "pass"}
  ],
  "verdict": "pass",
  "notes": "Repository-owned Harness, Viewer, and artifact-only delivery guard are present and previously validated."
}
